<?xml version="1.0" encoding="UTF-8"?>
<!DOCTYPE portion SYSTEM "..\Data\PAWSSKWriterDescription.dtd">
<portion>
	<section1 id="sRelCl">
		<secTitle>Relative Clauses</secTitle>
		<p>
			<content>Relative clauses normally modify a head noun and have one of four structures:</content>
		</p>
		<ul>
			<li>
				<content>like a complement clause headed by 'that', as in </content>
				<langData>the man that came to the meeting late</langData>
				<content>;</content>
			</li>
			<li>
				<content>like a content question with 'who' or 'which' fronted, as in </content>
				<langData>the man who came to the meeting late</langData>
				<content>;</content>
			</li>
			<li>
				<content>(or for some languages other than English) like a complement clause but with a special relative marker occurring in the complementizer position, or possibly with two markers which occur on each sides of the relative clause;</content>
			</li>
			<li>
				<content>(or for some languages other than English) like a regular sentence with a relative marker attached to the verb.</content>
			</li>
		</ul>
		<p>
			<content>Some languages also allow one of the above structures to occur by itself as a nominal phrase without a head noun to modify, usually called "headless" relative clauses.</content>
		</p>
		<p>
			<content>&#x20;</content>
			<langName/>
			<content>&#x20;</content>
			<case element="relcl" attr="type">
				<caseText value="none"> does not have any kind of relative clause.</caseText>
				<caseText value="IP"> has relative clauses which are like a regular sentence with a relative marker attached to the verb.</caseText>
				<caseText value="CP"> has relative clauses </caseText>
			</case>
			<content>&#x20;</content>
			<text show="swRelClTypeCP">
				<content>&#x20;</content>
				<case element="relcl" attr="compCP">
					<caseText value="no">which are like questions because a "wh" word is fronted.</caseText>
					<caseText value="yes">which are like complement clauses with relative markers that </caseText>
					<caseText value="yesBoth">which are like questions because a "wh" word is fronted and also relative clauses which are like complement clauses with relative markers that </caseText>
				</case>
				<text show="swRelClCompCPNotNo">
					<content>are </content>
					<case element="relcl" attr="relWord">
						<caseText value="yes">written as a separate word.</caseText>
						<caseText value="no">clitics which attach to another word at the edge of the relative clause.</caseText>
					</case>
					<content>&#x20;</content>
					<text show="swRelClTypeCPCompClitic">
						<content>&#x20;</content>
						<case element="relcl" attr="relCliticPos">
							<caseText value="before">These clitics are pro-clitics.</caseText>
							<caseText value="after">These clitics are post-clitics.</caseText>
							<caseText value="both">Some of the clitics are pro-clitics and some are post-clitics.</caseText>
						</case>
						<content>&#x20;</content>
					</text>
					<content>&#x20;</content>
					<text show="swRelClTypeCPCompWord">
						<content>&#x20;</content>
						<case element="relcl" attr="relCompSame">
							<caseText value="yes">Some of</caseText>
							<caseText value="no">None of</caseText>
						</case>
						<content> the relative markers are the same as the complementizer(s) used in verbal complement clauses.  The relative marker occurs </content>
						<case element="relcl" attr="relCompPos">
							<caseText value="before">before</caseText>
							<caseText value="after">after</caseText>
							<caseText value="either">on either side (but not both sides) of</caseText>
							<caseText value="beforeOrBoth">before or on both sides of</caseText>
							<caseText value="afterOrBoth">after or on both sides of</caseText>
							<caseText value="both">on both sides of</caseText>
						</case>
						<content> the sentence part of the relative clause.</content>
						<text show="swRelClTypeCPCompEitherUnrestricted">
							<content>All of the relative markers can occur on either side.</content>
						</text>
						<content>&#x20;</content>
						<text show="swRelClTypeCPCompEitherRestricted">
							<content>There are restrictions as to which of the relative markers can occur on each side.</content>
						</text>
						<content>&#x20;</content>
					</text>
					<content>&#x20;</content>
				</text>
				<content>&#x20;</content>
			</text>
			<content>&#x20;</content>
			<text show="swRelClTypeCPWh">
				<content>In the "wh"-relative clauses, </content>
				<case element="relcl" attr="whAndComp">
					<caseText value="no">only the "wh"-word occurs without any type of relative marker.</caseText>
					<caseText value="yes">the "wh"-word and the relative marker(s) are required to both be present.</caseText>
					<caseText value="optional">a relative marker may optionally co-occur along with the "wh"-word.</caseText>
				</case>
				<content>&#x20;</content>
			</text>
			<content>&#x20;</content>
		</p>
		<p show="swRelClTypeNotNone">
			<content>Examples of relative clauses in </content>
			<langName/>
			<content> include:</content>
		</p>
		<example show="swRelClTypeNotNone">
			<interlinear exampleLoc="relcl/example"/>
		</example>
		<p show="swRelClTypeNotNone">
			<content>Full sentence examples of the above relative clauses include:</content>
		</p>
		<example show="swRelClTypeNotNone">
			<interlinear exampleLoc="relcl/sentExample"/>
		</example>
		<p show="swRelClTypeNotNone">
			<content>&#x20;</content>
			<langName/>
			<content>&#x20;</content>
			<case element="relcl" attr="headless">
				<caseText value="no">requires a head noun to be present in all relative clauses, so no headless relative clauses are allowed.</caseText>
				<caseText value="yes">allows a head noun to be missing in relative clauses, so headless relative clauses are allowed.</caseText>
			</case>
			<content>&#x20;</content>
		</p>
		<p show="swRelClHeadlessYes">
			<content>Examples of headless relative clauses included in full sentences include:</content>
		</p>
		<example show="swRelClHeadlessYes">
			<interlinear exampleLoc="relcl/headlessExample"/>
		</example>
	</section1>
	<showWhen id="swRelClTypeCP">
		<whenValue element="relcl" attr="type" value="CP"/>
	</showWhen>
<showWhen id="swRelClTypeNotNone">
	<whenValue element="relcl" attr="type" value="none" negateValue="yes"></whenValue>
</showWhen>
	<showWhen id="swRelClTypeCPCompClitic">
		<whenValue element="relcl" attr="relWord" value="no"/>
		<and/>
		<whenValue element="relcl" attr="type" value="CP"/>
		<and/>
		<whenValue element="relcl" attr="compCP" value="no" negateValue="yes"/>
		<or/>
		<whenValue element="relcl" attr="relWord" value="no"/>
		<and/>
		<whenValue element="relcl" attr="type" value="CP"/>
		<and/>
		<whenValue element="relcl" attr="compCP" value="no"/>
		<and/>
		<whenValue element="relcl" attr="whAndComp" value="no" negateValue="yes"/>
	</showWhen>
	<showWhen id="swRelClCompCPNotNo">
		<whenValue element="relcl" attr="type" value="CP"/>
		<and/>
		<whenValue element="relcl" attr="compCP" value="no" negateValue="yes"/>
		<or/>
		<whenValue element="relcl" attr="type" value="CP"/>
		<and/>
		<whenValue element="relcl" attr="compCP" value="no"/>
		<and/>
		<whenValue element="relcl" attr="whAndComp" value="no" negateValue="yes"/>
	</showWhen>
	<showWhen id="swRelClTypeCPCompWord">
		<whenValue element="relcl" attr="relWord" value="yes"/>
		<and/>
		<whenValue element="relcl" attr="type" value="CP"/>
		<and/>
		<whenValue element="relcl" attr="compCP" value="no" negateValue="yes"/>
		<or/>
		<whenValue element="relcl" attr="relWord" value="yes"/>
		<and/>
		<whenValue element="relcl" attr="type" value="CP"/>
		<and/>
		<whenValue element="relcl" attr="compCP" value="no"/>
		<and/>
		<whenValue element="relcl" attr="whAndComp" value="no" negateValue="yes"/>
	</showWhen>
	<showWhen id="swRelClTypeCPWh">
		<whenValue element="relcl" attr="type" value="CP"/>
		<and/>
		<whenValue element="relcl" attr="compCP" value="yes" negateValue="yes"/>
	</showWhen>
	<showWhen id="swRelClTypeCPCompEitherRestricted">
		<whenValue element="relcl" attr="relWord" value="yes"/>
		<and/>
		<whenValue element="relcl" attr="relCompEitherRestricted" value="restricted"/>
		<and/>
		<whenValue element="relcl" attr="type" value="CP"/>
		<and/>
		<whenValue element="relcl" attr="compCP" value="no" negateValue="yes"/>
		<and/>
		<whenValue element="relcl" attr="relCompPos" value="before" negateValue="yes"/>
		<and/>
		<whenValue element="relcl" attr="relCompPos" value="after" negateValue="yes"/>
	</showWhen>
	<showWhen id="swRelClTypeCPCompEitherUnrestricted">
		<whenValue element="relcl" attr="relWord" value="yes"/>
		<and/>
		<whenValue element="relcl" attr="relCompEitherRestricted" value="unrestricted"/>
		<and/>
		<whenValue element="relcl" attr="type" value="CP"/>
		<and/>
		<whenValue element="relcl" attr="compCP" value="no" negateValue="yes"/>
		<and/>
		<whenValue element="relcl" attr="relCompPos" value="before" negateValue="yes"/>
		<and/>
		<whenValue element="relcl" attr="relCompPos" value="after" negateValue="yes"/>
	</showWhen>
	<showWhen id="swRelClHeadlessYes">
		<whenValue element="relcl" attr="headless" value="yes"/>
	</showWhen>
</portion>
